{
  "schema_version": "certify-datasets/1",
  "config_version": "v2-probe-capture-sample-1",
  "notes": "P-022 section A committed selection rules. Frozen BEFORE any candidate output was inspected. Contains no zids, report ids, topics or text; it is safe in a public repository. Roles with group=replacement are resolved in array order and each one excludes every conversation an earlier replacement role already took ('among remaining' in the spec's large-shape rule); group=stress roles are resolved afterwards WITHOUT exclusion and may reuse a conversation, in which case the manifest discloses the overlap. Every order_by list ends with zid ascending, which is the only tie-break and happens entirely inside the private selection process. A threshold or rank change requires a reviewed config edit and a new bundle version; the resolver never silently picks a smaller case.",
  "public_fixtures": [
    {
      "slug": "vw",
      "role": "public-medium",
      "notes": "retained public fixture, pinned by file hash in the bundle manifest"
    },
    {
      "slug": "biodiversity",
      "role": "public-small",
      "notes": "retained public fixture, pinned by file hash in the bundle manifest"
    }
  ],
  "coverage_role_map": {
    "pc-revote-02": "revote-heavy",
    "pc-banned-01": "banned-participant",
    "pc-zerovote-01": "zero-vote",
    "pc-smallmix-01": "small-mix",
    "pc-midmix-01": "mid-mix",
    "pc-modheavy-01": "moderation-heavy",
    "pc-meta-01": "meta-rich-cold",
    "pc-meta-02": "meta-rich-warm",
    "FLI": "large-shape-rank-16",
    "bg2018": "large-shape-rank-8",
    "pakistan": "large-shape-rank-4",
    "engage": "large-shape-rank-2",
    "bg2050": "large-shape-rank-1"
  },
  "metrics": {
    "V": {
      "definition": "full vote-event count: COUNT(*) over votes rows for the conversation, revotes included",
      "denominator": "n/a (a count)"
    },
    "U": {
      "definition": "distinct (pid, tid) cells: COUNT(DISTINCT (pid, tid)) over votes rows",
      "denominator": "n/a (a count)"
    },
    "P": {
      "definition": "distinct voting participants: COUNT(DISTINCT pid) over votes rows. This is the allocated-matrix-row count, NOT registered_participants.",
      "denominator": "n/a (a count)"
    },
    "C": {
      "definition": "comments referenced by votes: COUNT(DISTINCT tid) over votes rows",
      "denominator": "n/a (a count)"
    },
    "revote_share": {
      "definition": "(V - U) / V",
      "denominator": "V, the full vote-event count",
      "null_when": "V = 0"
    },
    "density": {
      "definition": "U / (P * C); pass votes count as observed cells, missing votes do not",
      "denominator": "matrix_area = P * C",
      "null_when": "P * C = 0"
    },
    "matrix_area": {
      "definition": "P * C",
      "denominator": "n/a (a product of counts)"
    },
    "mod_out_share": {
      "definition": "count of comments with mod = -1, divided by ALL comments of the conversation",
      "denominator": "all_comments (every row in comments for the conversation, moderated-out and meta included)",
      "null_when": "all_comments = 0"
    },
    "meta_share": {
      "definition": "count of comments with is_meta = true, divided by ALL comments of the conversation",
      "denominator": "all_comments (every row in comments for the conversation)",
      "null_when": "all_comments = 0"
    },
    "registered_participants": {
      "definition": "COUNT(*) over participants rows for the conversation; recorded for provenance only and never substituted for P",
      "denominator": "n/a (a count)"
    },
    "all_comments": {
      "definition": "COUNT(*) over comments rows for the conversation",
      "denominator": "n/a (a count)"
    },
    "math_eligible_comments": {
      "definition": "COUNT(*) over comments with mod <> -1 AND is_meta = false, matching the engine's mod-out rule (is_meta OR mod = -1 excludes a comment)",
      "denominator": "n/a (a count)"
    },
    "eligible_participants": {
      "definition": "COUNT(DISTINCT pid) over votes rows whose tid is a math-eligible comment; participant ban flags do NOT filter here, per the accepted removal of participant-ban filtering",
      "denominator": "n/a (a count)"
    },
    "banned_voters": {
      "definition": "COUNT(DISTINCT pid) over votes rows whose participant row has mod = -1",
      "denominator": "n/a (a count)"
    },
    "mod_out_or_meta_comments": {
      "definition": "COUNT(*) over comments with is_meta = true OR mod = -1, i.e. the engine's mod-out set; reported alongside mod_out_share so the two notions are never confused",
      "denominator": "n/a (a count)"
    },
    "zid": {
      "definition": "the conversation's numeric identifier; used ONLY as the final ascending tie-break inside the private selection process and never emitted publicly",
      "denominator": "n/a"
    }
  },
  "roles": [
    {
      "role": "revote-heavy",
      "slug": "pc-v1-revote",
      "group": "replacement",
      "rank": 1,
      "predicates": [
        {
          "metric": "V",
          "op": "ge",
          "value": 5000
        },
        {
          "metric": "V",
          "op": "le",
          "value": 15000
        },
        {
          "metric": "P",
          "op": "ge",
          "value": 30
        },
        {
          "metric": "revote_share",
          "op": "ge",
          "value": 0.25
        }
      ],
      "order_by": [
        {
          "metric": "revote_share",
          "direction": "desc"
        },
        {
          "metric": "V",
          "direction": "desc"
        },
        {
          "metric": "zid",
          "direction": "asc"
        }
      ],
      "on_missing": "fail",
      "exercise": "Six cuts; split at a revote; older retry with newer vote; include pass transitions."
    },
    {
      "role": "banned-participant",
      "slug": "pc-v1-banned",
      "group": "replacement",
      "rank": 1,
      "predicates": [
        {
          "metric": "banned_voters",
          "op": "ge",
          "value": 1
        }
      ],
      "order_by": [
        {
          "metric": "banned_voters",
          "direction": "desc"
        },
        {
          "metric": "V",
          "direction": "desc"
        },
        {
          "metric": "zid",
          "direction": "asc"
        }
      ],
      "on_missing": "fail",
      "exercise": "Six cuts; toggle ban flags without changing math output, per the accepted removal of participant-ban filtering."
    },
    {
      "role": "zero-vote",
      "slug": "pc-v1-zerovote",
      "group": "replacement",
      "rank": 1,
      "predicates": [
        {
          "metric": "V",
          "op": "eq",
          "value": 0
        },
        {
          "metric": "all_comments",
          "op": "ge",
          "value": 1
        }
      ],
      "order_by": [
        {
          "metric": "registered_participants",
          "direction": "asc"
        },
        {
          "metric": "all_comments",
          "direction": "asc"
        },
        {
          "metric": "zid",
          "direction": "asc"
        }
      ],
      "on_missing": "fail",
      "exercise": "Explicit compute/bootstrap event; valid empty outputs, timestamp zero, no invented votes."
    },
    {
      "role": "small-mix",
      "slug": "pc-v1-smallmix",
      "group": "replacement",
      "rank": 1,
      "predicates": [
        {
          "metric": "V",
          "op": "gt",
          "value": 0
        },
        {
          "metric": "V",
          "op": "le",
          "value": 5000
        },
        {
          "metric": "revote_share",
          "op": "lt",
          "value": 0.1
        },
        {
          "metric": "mod_out_share",
          "op": "lt",
          "value": 0.2
        },
        {
          "metric": "meta_share",
          "op": "eq",
          "value": 0
        },
        {
          "metric": "banned_voters",
          "op": "eq",
          "value": 0
        }
      ],
      "order_by": [
        {
          "metric": "V",
          "direction": "desc"
        },
        {
          "metric": "zid",
          "direction": "asc"
        }
      ],
      "on_missing": "fail",
      "exercise": "Single, uniform and burst schedules.",
      "notes": "'no meta/banned voters' is expressed as meta_share = 0 (denominator all_comments) and banned_voters = 0."
    },
    {
      "role": "mid-mix",
      "slug": "pc-v1-midmix",
      "group": "replacement",
      "rank": 1,
      "predicates": [
        {
          "metric": "V",
          "op": "gt",
          "value": 5000
        },
        {
          "metric": "V",
          "op": "le",
          "value": 50000
        },
        {
          "metric": "revote_share",
          "op": "lt",
          "value": 0.1
        },
        {
          "metric": "mod_out_share",
          "op": "lt",
          "value": 0.2
        },
        {
          "metric": "meta_share",
          "op": "eq",
          "value": 0
        },
        {
          "metric": "banned_voters",
          "op": "eq",
          "value": 0
        }
      ],
      "order_by": [
        {
          "metric": "V",
          "direction": "desc"
        },
        {
          "metric": "zid",
          "direction": "asc"
        }
      ],
      "on_missing": "fail",
      "exercise": "Six cuts, plus a restart after cut three."
    },
    {
      "role": "moderation-heavy",
      "slug": "pc-v1-modheavy",
      "group": "replacement",
      "rank": 1,
      "predicates": [
        {
          "metric": "mod_out_share",
          "op": "ge",
          "value": 0.2
        },
        {
          "metric": "V",
          "op": "gt",
          "value": 0
        }
      ],
      "order_by": [
        {
          "metric": "mod_out_share",
          "direction": "desc"
        },
        {
          "metric": "V",
          "direction": "desc"
        },
        {
          "metric": "zid",
          "direction": "asc"
        }
      ],